{
  "id": "dr-1-1773954498185",
  "timestamp": "2026-03-19T21:08:18.185Z",
  "task_id": "validate-real-work-capture",
  "input_artifact_ids": [
    "na-b296cf14-5a1b-4c00-bd63-090d34c7a3d6"
  ],
  "rules_applied": [
    "progress_detected"
  ],
  "prior_state": "not_started",
  "output_state": "in_progress"
}
